{
  "isNewFulfilmentBusiness": false,
  "hasTradingName": false,
  "hasVatRegistrationNumber": false,
  "numberOfCustomersOutsideOfEU": "1-10",
  "companyName": "Jon Snow",
  "companyUTR": "1111111111",
  "companyRegistrationNumber": "123456789",
  "registeredAddress": {
    "line1": "23 High Street",
    "line2": "Park View",
    "line3": "Gloucester",
    "town": "Gloucestershire",
    "postalCode": "NE98 1ZZ",
    "countryCode": "GB"
  },
  "principalTradingBusinessAddress": {
    "line1": "23 High Street",
    "line2": "Park View",
    "line3": "Gloucester",
    "town": "Gloucestershire",
    "postalCode": "NE98 1ZZ",
    "countryCode": "US"
  },
  "companyOfficials": [
    {
      "firstName": "Fname",
      "lastName": "LName",
      "hasNino": false,
      "role": "Director"
    }
  ],
  "isPrincipalPlaceOfBusinessForLastThreeYears": true,
  "numberOfYearsAtPrincipalBusinessAddress": "3 to 5 years",
  "hasOtherStorageSites": false,
  "contactPerson": {
    "firstName": "Fname",
    "lastName": "LName",
    "telephoneNumber": "112313212"
  },
  "contactAddress": {
    "line1": "23 High Street",
    "line2": "Park View",
    "line3": "Gloucester",
    "town": "Gloucestershire",
    "postalCode": "NE98 1ZZ",
    "countryCode": "GB"
  }
}