{
  "companyName": "Jon Snow",
  "companyUTR": "1111111111",
  "companyRegistrationNumber": "123456789",
  "registeredAddress": {
    "line1": "23 High Street",
    "line2": "Park View",
    "line3": "Gloucester",
    "town": "Gloucestershire",
    "postalCode": "NE98 1ZZ",
    "countryCode": "GB"
  },
  "principalTradingBusinessAddress": {
    "line1": "23 High Street",
    "line2": "Park View",
    "line3": "Gloucester",
    "town": "Gloucestershire",
    "postalCode": "NE98 1ZZ",
    "countryCode": "US"
  },
  "isNewFulfilmentBusiness": true,
  "intendedStartTradingDate": "31/07/2018",
  "hasTradingName": true,
  "tradingName": "DodgyCO",
  "hasVatRegistrationNumber": true,
  "vatRegistrationNumber": "123456789",
  "numberOfCustomersOutsideOfEU": "1-10",
  "companyOfficials": [
    {
      "firstName": "FName",
      "lastName": "LName",
      "hasNino": true,
      "nino": "AA252813D",
      "role": "Director"
    },
    {
      "firstName": "FNameI",
      "lastName": "LNameI",
      "hasNino": true,
      "nino": "AA123456B",
      "role": "Director+Secretary"
    }
  ],
  "isPrincipalPlaceOfBusinessForLastThreeYears": false,
  "previousPrincipalTradingBusinessAddresses": [
    {
      "line1": "aline1",
      "line2": "line2",
      "town": "town",
      "postalCode": "AA00 0AA",
      "countryCode": "GB"
    }
  ],
  "hasOtherStorageSites":true,
  "otherStorageSites": [
    {
      "line1": "Flat 1A",
      "line2": "asfasdf",
      "town": "3333",
      "postalCode": "ZZ11 1ZZ",
      "countryCode": "GB"
    },
    {
      "line1": "address1",
      "line2": "address2",
      "town": "some town",
      "postalCode": "AA00 0AA",
      "countryCode": "GB"
    }
  ],
  "contactPerson": {
    "firstName": "FnameT",
    "lastName": "LNameT",
    "telephoneNumber": "1313131231"
  },
  "contactAddress": {
    "line1": "l1",
    "line2": "l2",
    "town": "cl",
    "postalCode": "Z99 2YY",
    "countryCode": "GB"
  }
}