{
  "isNewFulfilmentBusiness": true,
  "intendedStartTradingDate": "02/02/2018",
  "companyName": "FH Ltd",
  "companyUTR": "8123456789",
  "hasTradingName": true,
  "tradingName": "ABC Company Ltd",
  "vatRegistrationNumber": "123456789",
  "companyRegistrationNumber": "123456789",
  "numberOfCustomersOutsideOfEU": "51-100",
  "isPrincipalPlaceOfBusinessForLastThreeYears": false,
  "hasVatRegistrationNumber": true,
  "registeredAddress": {
    "line1": "123 ABC Street",
    "line2": "",
    "line3": "",
    "town": "Some Town",
    "postalCode": "AB1 2CD",
    "countryCode": "GB"
  },
  "principalTradingBusinessAddress": {
    "line1": "123 ABC Street",
    "line2": "",
    "line3": "",
    "town": "Some Town",
    "postalCode": "AB1 2CD",
    "countryCode": "GB"
  },
  "previousPrincipalTradingBusinessAddresses": [{
    "line1": "123 ABC Street",
    "line2": "",
    "line3": "",
    "town": "Some Town",
    "postalCode": "AB1 2CD",
    "countryCode": "GB"
  }],
  "hasOtherStorageSites": true,
  "otherStorageSites": [
    {
      "line1": "123 ABC Street",
      "line2": "",
      "line3": "",
      "town": "Some Town",
      "postalCode": "AB1 2CD",
      "countryCode": "GB"
    }
  ],
  "contactAddress": {
    "line1": "123 ABC Street",
    "line2": "",
    "line3": "Some Town",
    "line4": "AB1 2CD",
    "countryCode": "GB"
  },
  "companyOfficials": [
    {
      "firstName": "George",
      "lastName": "Smith",
      "hasNino": true,
      "nino": "AA123456A",
      "role": "Director"
    }
  ],
  "contactPerson": {
    "firstName": "George",
    "lastName": "Smith",
    "telephoneNumber": "0999012345678"
  }
}